id,canonical_slug,name,developer,model,created,description,context_length,architecture_input_modalities,architecture_output_modalities,architecture_tokenizer,architecture_instruct_type,pricing_prompt,pricing_completion,pricing_request,pricing_image,pricing_web_search,pricing_internal_reasoning,pricing_input_cache_read,pricing_input_cache_write,top_provider_context_length,top_provider_max_completion_tokens,top_provider_is_moderated,supported_parameters,default_parameters,expiration_date,knowledge_cutoff,links,per_request_limits,supported_voices,hugging_face_id,benchmarks_design_arena
"qwen/qwen3-next-80b-a3b-thinking","qwen/qwen3-next-80b-a3b-thinking-2509","Qwen: Qwen3 Next 80B A3B Thinking","Qwen","Qwen3 Next 80B A3B Thinking","1757612284","Qwen3-Next-80B-A3B-Thinking is a reasoning-first chat model in the Qwen3-Next line that outputs structured “thinking” traces by default. It’s designed for hard multi-step problems; math proofs; code synthesis/debugging; logic; and agentic...","262144","text","text","Qwen3","","0.0000000975","0.00000078","","","","","","","131072","32768","","frequency_penalty|include_reasoning|logprobs|max_tokens|presence_penalty|reasoning|repetition_penalty|response_format|seed|stop|structured_outputs|temperature|tool_choice|tools|top_k|top_logprobs|top_p","{""temperature"":null;""top_p"":null;""frequency_penalty"":null}","","2025-09-30","{""details"":""/api/v1/models/qwen/qwen3-next-80b-a3b-thinking-2509/endpoints""}","null","null","Qwen/Qwen3-Next-80B-A3B-Thinking",""
"qwen/qwen3-next-80b-a3b-instruct:free","qwen/qwen3-next-80b-a3b-instruct-2509","Qwen: Qwen3 Next 80B A3B Instruct (free)","Qwen","Qwen3 Next 80B A3B Instruct (free)","1757612213","Qwen3-Next-80B-A3B-Instruct is an instruction-tuned chat model in the Qwen3-Next series optimized for fast; stable responses without “thinking” traces. It targets complex tasks across reasoning; code generation; knowledge QA; and multilingual...","262144","text","text","Qwen3","","0","0","","","","","","","262144","","","frequency_penalty|max_tokens|presence_penalty|response_format|stop|structured_outputs|temperature|tool_choice|tools|top_k|top_p","{}","","2025-09-30","{""details"":""/api/v1/models/qwen/qwen3-next-80b-a3b-instruct-2509/endpoints""}","null","null","Qwen/Qwen3-Next-80B-A3B-Instruct",""
"qwen/qwen3-next-80b-a3b-instruct","qwen/qwen3-next-80b-a3b-instruct-2509","Qwen: Qwen3 Next 80B A3B Instruct","Qwen","Qwen3 Next 80B A3B Instruct","1757612213","Qwen3-Next-80B-A3B-Instruct is an instruction-tuned chat model in the Qwen3-Next series optimized for fast; stable responses without “thinking” traces. It targets complex tasks across reasoning; code generation; knowledge QA; and multilingual...","262144","text","text","Qwen3","","0.00000009","0.0000011","","","","","","","262144","16384","","frequency_penalty|logit_bias|logprobs|max_tokens|min_p|presence_penalty|repetition_penalty|response_format|seed|stop|structured_outputs|temperature|tool_choice|tools|top_k|top_logprobs|top_p","{}","","2025-09-30","{""details"":""/api/v1/models/qwen/qwen3-next-80b-a3b-instruct-2509/endpoints""}","null","null","Qwen/Qwen3-Next-80B-A3B-Instruct",""
"qwen/qwen-plus-2025-07-28:thinking","qwen/qwen-plus-2025-07-28","Qwen: Qwen Plus 0728 (thinking)","Qwen","Qwen Plus 0728 (thinking)","1757347599","Qwen Plus 0728; based on the Qwen3 foundation model; is a 1 million context hybrid reasoning model with a balanced performance; speed; and cost combination.","1000000","text","text","Qwen3","","0.00000026","0.00000078","","","","","","0.000000325","1000000","32768","","include_reasoning|max_tokens|presence_penalty|reasoning|response_format|seed|structured_outputs|temperature|tool_choice|tools|top_p","{""temperature"":null;""top_p"":null;""frequency_penalty"":null}","","2025-03-31","{""details"":""/api/v1/models/qwen/qwen-plus-2025-07-28/endpoints""}","null","null","",""
"qwen/qwen-plus-2025-07-28","qwen/qwen-plus-2025-07-28","Qwen: Qwen Plus 0728","Qwen","Qwen Plus 0728","1757347599","Qwen Plus 0728; based on the Qwen3 foundation model; is a 1 million context hybrid reasoning model with a balanced performance; speed; and cost combination.","1000000","text","text","Qwen3","","0.00000026","0.00000078","","","","","","","1000000","32768","","logprobs|max_tokens|presence_penalty|response_format|seed|structured_outputs|temperature|tool_choice|tools|top_logprobs|top_p","{""temperature"":null;""top_p"":null;""frequency_penalty"":null}","","2025-03-31","{""details"":""/api/v1/models/qwen/qwen-plus-2025-07-28/endpoints""}","null","null","",""
"nvidia/nemotron-nano-9b-v2:free","nvidia/nemotron-nano-9b-v2","NVIDIA: Nemotron Nano 9B V2 (free)","NVIDIA","Nemotron Nano 9B V2 (free)","1757106807","NVIDIA-Nemotron-Nano-9B-v2 is a large language model (LLM) trained from scratch by NVIDIA; and designed as a unified model for both reasoning and non-reasoning tasks. It responds to user queries and...","128000","text","text","Other","","0","0","","","","","","","128000","","","include_reasoning|max_tokens|reasoning|response_format|seed|structured_outputs|temperature|tool_choice|tools|top_p","{""temperature"":null;""top_p"":null;""frequency_penalty"":null}","","2025-03-31","{""details"":""/api/v1/models/nvidia/nemotron-nano-9b-v2/endpoints""}","null","null","nvidia/NVIDIA-Nemotron-Nano-9B-v2",""
"moonshotai/kimi-k2-0905","moonshotai/kimi-k2-0905","MoonshotAI: Kimi K2 0905","MoonshotAI","Kimi K2 0905","1757021147","Kimi K2 0905 is the September update of [Kimi K2 0711](moonshotai/kimi-k2). It is a large-scale Mixture-of-Experts (MoE) language model developed by Moonshot AI; featuring 1 trillion total parameters with 32...","262144","text","text","Other","","0.0000006","0.0000025","","","","","","","262144","100352","","frequency_penalty|max_tokens|presence_penalty|repetition_penalty|response_format|seed|stop|structured_outputs|temperature|tool_choice|tools|top_k|top_p","{}","","2024-12-31","{""details"":""/api/v1/models/moonshotai/kimi-k2-0905/endpoints""}","null","null","moonshotai/Kimi-K2-Instruct-0905","models/codecategories:elo=1147,wr=48.5,rank=72|models/website:elo=1150,wr=48.3,rank=73"
"qwen/qwen3-30b-a3b-thinking-2507","qwen/qwen3-30b-a3b-thinking-2507","Qwen: Qwen3 30B A3B Thinking 2507","Qwen","Qwen3 30B A3B Thinking 2507","1756399192","Qwen3-30B-A3B-Thinking-2507 is a 30B parameter Mixture-of-Experts reasoning model optimized for complex tasks requiring extended multi-step thinking. The model is designed specifically for “thinking mode;” where internal reasoning traces are separated...","131072","text","text","Qwen3","","0.00000013","0.00000156","","","","","","","81920","32768","","include_reasoning|max_tokens|presence_penalty|reasoning|response_format|seed|temperature|tool_choice|tools|top_p","{}","","2025-06-30","{""details"":""/api/v1/models/qwen/qwen3-30b-a3b-thinking-2507/endpoints""}","null","null","Qwen/Qwen3-30B-A3B-Thinking-2507","models/dataviz:elo=969,wr=33.3,rank=95|models/website:elo=973,wr=35.5,rank=103"
"nousresearch/hermes-4-70b","nousresearch/hermes-4-70b","Nous: Hermes 4 70B","Nous","Hermes 4 70B","1756236182","Hermes 4 70B is a hybrid reasoning model from Nous Research; built on Meta-Llama-3.1-70B. It introduces the same hybrid mode as the larger 405B release; allowing the model to either...","131072","text","text","Llama3","","0.00000013","0.0000004","","","","","","","131072","","","frequency_penalty|include_reasoning|max_tokens|presence_penalty|reasoning|repetition_penalty|response_format|temperature|top_k|top_p","{}","","2024-08-31","{""details"":""/api/v1/models/nousresearch/hermes-4-70b/endpoints""}","null","null","NousResearch/Hermes-4-70B",""
"nousresearch/hermes-4-405b","nousresearch/hermes-4-405b","Nous: Hermes 4 405B","Nous","Hermes 4 405B","1756235463","Hermes 4 is a large-scale reasoning model built on Meta-Llama-3.1-405B and released by Nous Research. It introduces a hybrid reasoning mode; where the model can choose to deliberate internally with...","131072","text","text","Other","","0.000001","0.000003","","","","","","","131072","","","frequency_penalty|include_reasoning|max_tokens|presence_penalty|reasoning|repetition_penalty|response_format|temperature|top_k|top_p","{}","","2024-08-31","{""details"":""/api/v1/models/nousresearch/hermes-4-405b/endpoints""}","null","null","NousResearch/Hermes-4-405B",""
"deepseek/deepseek-chat-v3.1","deepseek/deepseek-chat-v3.1","DeepSeek: DeepSeek V3.1","DeepSeek","DeepSeek V3.1","1755779628","DeepSeek-V3.1 is a large hybrid reasoning model (671B parameters; 37B active) that supports both thinking and non-thinking modes via prompt templates. It extends the DeepSeek-V3 base with a two-phase long-context...","163840","text","text","DeepSeek","deepseek-v3.1","0.00000021","0.00000079","","","","","0.00000013","","163840","32768","","frequency_penalty|include_reasoning|logit_bias|logprobs|max_tokens|min_p|presence_penalty|reasoning|repetition_penalty|response_format|seed|stop|structured_outputs|temperature|tool_choice|tools|top_k|top_logprobs|top_p","{}","","2025-03-31","{""details"":""/api/v1/models/deepseek/deepseek-chat-v3.1/endpoints""}","null","null","deepseek-ai/DeepSeek-V3.1","models/3d:elo=1155,wr=48,rank=62|models/codecategories:elo=1161,wr=47.9,rank=66|models/dataviz:elo=1143,wr=46.8,rank=67|models/gamedev:elo=1150,wr=47.2,rank=65|models/svg:elo=1024,wr=38.2,rank=71|models/uicomponent:elo=1138,wr=47.5,rank=65|models/website:elo=1165,wr=48,rank=64"
"mistralai/mistral-medium-3.1","mistralai/mistral-medium-3.1","Mistral: Mistral Medium 3.1","Mistral","Mistral Medium 3.1","1755095639","Mistral Medium 3.1 is an updated version of Mistral Medium 3; which is a high-performance enterprise-grade language model designed to deliver frontier-level capabilities at significantly reduced operational cost. It balances...","131072","text|image|file","text","Mistral","","0.0000004","0.000002","","","","","0.00000004","","131072","","","frequency_penalty|max_tokens|presence_penalty|response_format|seed|stop|structured_outputs|temperature|tool_choice|tools|top_p","{""temperature"":0.3}","","2025-06-30","{""details"":""/api/v1/models/mistralai/mistral-medium-3.1/endpoints""}","null","null","","models/3d:elo=1160,wr=44.7,rank=59|models/asciiart:elo=1044,wr=30.8,rank=48|models/codecategories:elo=1170,wr=45.1,rank=62|models/dataviz:elo=1191,wr=47.6,rank=53|models/gamedev:elo=1139,wr=40.7,rank=70|models/svg:elo=1050,wr=38.2,rank=64|models/uicomponent:elo=1152,wr=43.5,rank=62|models/website:elo=1175,wr=46,rank=62"
"z-ai/glm-4.5v","z-ai/glm-4.5v","Z.ai: GLM 4.5V","Z.ai","GLM 4.5V","1754922288","GLM-4.5V is a vision-language foundation model for multimodal agent applications. Built on a Mixture-of-Experts (MoE) architecture with 106B parameters and 12B activated parameters; it achieves state-of-the-art results in video understanding;...","65536","text|image","text","Other","","0.0000006","0.0000018","","","","","0.00000011","","65536","16384","","frequency_penalty|include_reasoning|max_tokens|presence_penalty|reasoning|repetition_penalty|response_format|seed|stop|temperature|tool_choice|tools|top_k|top_p","{""temperature"":0.75;""top_p"":null;""frequency_penalty"":null}","","2024-12-31","{""details"":""/api/v1/models/z-ai/glm-4.5v/endpoints""}","null","null","zai-org/GLM-4.5V",""
"ai21/jamba-large-1.7","ai21/jamba-large-1.7","AI21: Jamba Large 1.7","AI21","Jamba Large 1.7","1754669020","Jamba Large 1.7 is the latest model in the Jamba open family; offering improvements in grounding; instruction-following; and overall efficiency. Built on a hybrid SSM-Transformer architecture with a 256K context...","256000","text","text","Other","","0.000002","0.000008","","","","","","","256000","4096","","max_tokens|response_format|stop|temperature|tool_choice|tools|top_p","{}","","2024-08-31","{""details"":""/api/v1/models/ai21/jamba-large-1.7/endpoints""}","null","null","ai21labs/AI21-Jamba-Large-1.7",""
"openai/gpt-5-chat","openai/gpt-5-chat-2025-08-07","OpenAI: GPT-5 Chat","OpenAI","GPT-5 Chat","1754587837","GPT-5 Chat is designed for advanced; natural; multimodal; and context-aware conversations for enterprise applications.","128000","file|image|text","text","GPT","","0.00000125","0.00001","","","0.01","","0.000000125","","128000","16384","true","max_tokens|response_format|seed|structured_outputs","{}","","2024-09-30","{""details"":""/api/v1/models/openai/gpt-5-chat-2025-08-07/endpoints""}","null","null","",""
"openai/gpt-5","openai/gpt-5-2025-08-07","OpenAI: GPT-5","OpenAI","GPT-5","1754587413","GPT-5 is OpenAI’s most advanced model; offering major improvements in reasoning; code quality; and user experience. It is optimized for complex tasks that require step-by-step reasoning; instruction following; and accuracy...","400000","text|image|file","text","GPT","","0.00000125","0.00001","","","0.01","","0.000000125","","400000","128000","","include_reasoning|max_completion_tokens|max_tokens|reasoning|response_format|seed|structured_outputs|tool_choice|tools","{""temperature"":null;""top_p"":null;""top_k"":null;""frequency_penalty"":null;""presence_penalty"":null;""repetition_penalty"":null}","","2024-09-30","{""details"":""/api/v1/models/openai/gpt-5-2025-08-07/endpoints""}","null","null","","models/3d:elo=1134,wr=41.4,rank=69|models/asciiart:elo=1187,wr=49,rank=29|models/codecategories:elo=1218,wr=54.7,rank=44|models/dataviz:elo=1282,wr=63.3,rank=16|models/gamedev:elo=1252,wr=59.5,rank=32|models/svg:elo=1246,wr=64.1,rank=15|models/uicomponent:elo=1236,wr=58.3,rank=34|models/website:elo=1227,wr=53.7,rank=43"
"openai/gpt-5-mini","openai/gpt-5-mini-2025-08-07","OpenAI: GPT-5 Mini","OpenAI","GPT-5 Mini","1754587407","GPT-5 Mini is a compact version of GPT-5; designed to handle lighter-weight reasoning tasks. It provides the same instruction-following and safety-tuning benefits as GPT-5; but with reduced latency and cost....","400000","text|image|file","text","GPT","","0.00000025","0.000002","","","0.01","","0.000000025","","400000","128000","true","include_reasoning|max_completion_tokens|max_tokens|reasoning|response_format|seed|structured_outputs|tool_choice|tools","{""temperature"":null;""top_p"":null;""top_k"":null;""frequency_penalty"":null;""presence_penalty"":null;""repetition_penalty"":null}","","2024-05-31","{""details"":""/api/v1/models/openai/gpt-5-mini-2025-08-07/endpoints""}","null","null","","models/3d:elo=1116,wr=37.1,rank=74|models/asciiart:elo=1173,wr=45.5,rank=34|models/codecategories:elo=1163,wr=43.5,rank=65|models/dataviz:elo=1170,wr=43.5,rank=60|models/gamedev:elo=1194,wr=46.4,rank=54|models/svg:elo=1149,wr=46,rank=44|models/uicomponent:elo=1159,wr=42.1,rank=58|models/website:elo=1167,wr=44.4,rank=63"
"openai/gpt-5-nano","openai/gpt-5-nano-2025-08-07","OpenAI: GPT-5 Nano","OpenAI","GPT-5 Nano","1754587402","GPT-5-Nano is the smallest and fastest variant in the GPT-5 system; optimized for developer tools; rapid interactions; and ultra-low latency environments. While limited in reasoning depth compared to its larger...","400000","text|image|file","text","GPT","","0.00000005","0.0000004","","","0.01","","0.00000001","","400000","","","include_reasoning|max_completion_tokens|max_tokens|reasoning|response_format|seed|structured_outputs|tool_choice|tools","{""temperature"":null;""top_p"":null;""top_k"":null;""frequency_penalty"":null;""presence_penalty"":null;""repetition_penalty"":null}","","2024-05-31","{""details"":""/api/v1/models/openai/gpt-5-nano-2025-08-07/endpoints""}","null","null","","models/3d:elo=1042,wr=36.1,rank=87|models/codecategories:elo=1134,wr=48.1,rank=75|models/dataviz:elo=1103,wr=46.7,rank=77|models/gamedev:elo=1111,wr=46.6,rank=77|models/uicomponent:elo=1121,wr=52,rank=71|models/website:elo=1144,wr=48.9,rank=75"
"openai/gpt-oss-120b:free","openai/gpt-oss-120b","OpenAI: gpt-oss-120b (free)","OpenAI","gpt-oss-120b (free)","1754414231","gpt-oss-120b is an open-weight; 117B-parameter Mixture-of-Experts (MoE) language model from OpenAI designed for high-reasoning; agentic; and general-purpose production use cases. It activates 5.1B parameters per forward pass and is optimized...","131072","text","text","GPT","","0","0","","","","","","","131072","131072","true","include_reasoning|max_tokens|min_p|reasoning|seed|stop|temperature|tool_choice|tools|top_a|top_k|top_p","{""temperature"":null;""top_p"":null;""frequency_penalty"":null}","","2024-06-30","{""details"":""/api/v1/models/openai/gpt-oss-120b/endpoints""}","null","null","openai/gpt-oss-120b","models/3d:elo=978,wr=29.4,rank=91|models/codecategories:elo=1012,wr=33.4,rank=98|models/dataviz:elo=1043,wr=45.1,rank=87|models/gamedev:elo=1059,wr=40.6,rank=85|models/uicomponent:elo=978,wr=35.5,rank=92|models/website:elo=1011,wr=32.5,rank=100"
"openai/gpt-oss-120b","openai/gpt-oss-120b","OpenAI: gpt-oss-120b","OpenAI","gpt-oss-120b","1754414231","gpt-oss-120b is an open-weight; 117B-parameter Mixture-of-Experts (MoE) language model from OpenAI designed for high-reasoning; agentic; and general-purpose production use cases. It activates 5.1B parameters per forward pass and is optimized...","131072","text","text","GPT","","0.00000003","0.00000015","","","","","","","131072","131072","","frequency_penalty|include_reasoning|logit_bias|logprobs|max_tokens|min_p|presence_penalty|reasoning|repetition_penalty|response_format|seed|stop|structured_outputs|temperature|tool_choice|tools|top_a|top_k|top_logprobs|top_p","{""temperature"":null;""top_p"":null;""frequency_penalty"":null}","","2024-06-30","{""details"":""/api/v1/models/openai/gpt-oss-120b/endpoints""}","null","null","openai/gpt-oss-120b","models/3d:elo=978,wr=29.4,rank=91|models/codecategories:elo=1012,wr=33.4,rank=98|models/dataviz:elo=1043,wr=45.1,rank=87|models/gamedev:elo=1059,wr=40.6,rank=85|models/uicomponent:elo=978,wr=35.5,rank=92|models/website:elo=1011,wr=32.5,rank=100"
"openai/gpt-oss-20b:free","openai/gpt-oss-20b","OpenAI: gpt-oss-20b (free)","OpenAI","gpt-oss-20b (free)","1754414229","gpt-oss-20b is an open-weight 21B parameter model released by OpenAI under the Apache 2.0 license. It uses a Mixture-of-Experts (MoE) architecture with 3.6B active parameters per forward pass; optimized for...","131072","text","text","GPT","","0","0","","","","","","","131072","32768","","frequency_penalty|include_reasoning|logprobs|max_tokens|min_p|presence_penalty|reasoning|repetition_penalty|response_format|seed|stop|structured_outputs|temperature|tool_choice|tools|top_a|top_k|top_logprobs|top_p","{""temperature"":null;""top_p"":null;""frequency_penalty"":null}","","2024-06-30","{""details"":""/api/v1/models/openai/gpt-oss-20b/endpoints""}","null","null","openai/gpt-oss-20b","models/dataviz:elo=977,wr=39.7,rank=93|models/website:elo=895,wr=27.9,rank=108"
"openai/gpt-oss-20b","openai/gpt-oss-20b","OpenAI: gpt-oss-20b","OpenAI","gpt-oss-20b","1754414229","gpt-oss-20b is an open-weight 21B parameter model released by OpenAI under the Apache 2.0 license. It uses a Mixture-of-Experts (MoE) architecture with 3.6B active parameters per forward pass; optimized for...","131072","text","text","GPT","","0.000000029","0.00000014","","","","","","","131072","","","frequency_penalty|include_reasoning|logit_bias|logprobs|max_tokens|min_p|presence_penalty|reasoning|repetition_penalty|response_format|seed|stop|structured_outputs|temperature|tool_choice|tools|top_k|top_logprobs|top_p","{""temperature"":null;""top_p"":null;""frequency_penalty"":null}","","2024-06-30","{""details"":""/api/v1/models/openai/gpt-oss-20b/endpoints""}","null","null","openai/gpt-oss-20b","models/dataviz:elo=977,wr=39.7,rank=93|models/website:elo=895,wr=27.9,rank=108"
"anthropic/claude-opus-4.1","anthropic/claude-4.1-opus-20250805","Anthropic: Claude Opus 4.1","Anthropic","Claude Opus 4.1","1754411591","Claude Opus 4.1 is an updated version of Anthropic’s flagship model; offering improved performance in coding; reasoning; and agentic tasks. It achieves 74.5% on SWE-bench Verified and shows notable gains...","200000","image|text|file","text","Claude","","0.000015","0.000075","","","0.01","","0.0000015","0.00001875","200000","32000","true","include_reasoning|max_tokens|reasoning|response_format|stop|structured_outputs|temperature|tool_choice|tools|top_k|top_p","{""temperature"":null;""top_p"":null;""top_k"":null;""frequency_penalty"":null;""presence_penalty"":null;""repetition_penalty"":null}","","2025-01-31","{""details"":""/api/v1/models/anthropic/claude-4.1-opus-20250805/endpoints""}","null","null","","models/3d:elo=1228,wr=51.7,rank=36|models/asciiart:elo=1212,wr=51.6,rank=19|models/codecategories:elo=1220,wr=55.8,rank=40|models/dataviz:elo=1209,wr=56.4,rank=44|models/gamedev:elo=1237,wr=58.5,rank=36|models/svg:elo=1210,wr=60.8,rank=26|models/uicomponent:elo=1217,wr=58,rank=41|models/website:elo=1220,wr=55.3,rank=46"
"mistralai/codestral-2508","mistralai/codestral-2508","Mistral: Codestral 2508","Mistral","Codestral 2508","1754079630","Mistral's cutting-edge language model for coding released end of July 2025. Codestral specializes in low-latency; high-frequency tasks such as fill-in-the-middle (FIM); code correction and test generation.  [Blog Post](https://mistral.ai/news/codestral-25-08)","256000","text|file","text","Mistral","","0.0000003","0.0000009","","","","","0.00000003","","256000","","","frequency_penalty|max_tokens|presence_penalty|response_format|seed|stop|structured_outputs|temperature|tool_choice|tools|top_p","{""temperature"":0.3}","","2025-03-31","{""details"":""/api/v1/models/mistralai/codestral-2508/endpoints""}","null","null","","models/codecategories:elo=1057,wr=38.5,rank=90|models/dataviz:elo=1061,wr=41.7,rank=85|models/gamedev:elo=1032,wr=36.2,rank=92|models/uicomponent:elo=1071,wr=46.9,rank=79|models/website:elo=1055,wr=37.8,rank=93|models/3d:elo=1098,wr=45.5,rank=77"
"qwen/qwen3-coder-30b-a3b-instruct","qwen/qwen3-coder-30b-a3b-instruct","Qwen: Qwen3 Coder 30B A3B Instruct","Qwen","Qwen3 Coder 30B A3B Instruct","1753972379","Qwen3-Coder-30B-A3B-Instruct is a 30.5B parameter Mixture-of-Experts (MoE) model with 128 experts (8 active per forward pass); designed for advanced code generation; repository-scale understanding; and agentic tool use. Built on the...","160000","text","text","Qwen3","","0.00000007","0.00000027","","","","","","","160000","32768","","frequency_penalty|logprobs|max_tokens|presence_penalty|repetition_penalty|response_format|seed|stop|structured_outputs|temperature|tool_choice|tools|top_k|top_logprobs|top_p","{}","","2025-06-30","{""details"":""/api/v1/models/qwen/qwen3-coder-30b-a3b-instruct/endpoints""}","null","null","Qwen/Qwen3-Coder-30B-A3B-Instruct","models/dataviz:elo=1128,wr=54.7,rank=74|models/uicomponent:elo=1100,wr=54.1,rank=73|models/website:elo=1130,wr=57.1,rank=78"
"qwen/qwen3-30b-a3b-instruct-2507","qwen/qwen3-30b-a3b-instruct-2507","Qwen: Qwen3 30B A3B Instruct 2507","Qwen","Qwen3 30B A3B Instruct 2507","1753806965","Qwen3-30B-A3B-Instruct-2507 is a 30.5B-parameter mixture-of-experts language model from Qwen; with 3.3B active parameters per inference. It operates in non-thinking mode and is designed for high-quality instruction following; multilingual understanding; and...","131072","text","text","Qwen3","","0.00000004815","0.00000019305","","","","","","","128000","32000","","frequency_penalty|logit_bias|logprobs|max_tokens|min_p|presence_penalty|repetition_penalty|response_format|seed|stop|structured_outputs|temperature|tool_choice|tools|top_k|top_logprobs|top_p","{}","","2025-06-30","{""details"":""/api/v1/models/qwen/qwen3-30b-a3b-instruct-2507/endpoints""}","null","null","Qwen/Qwen3-30B-A3B-Instruct-2507",""
"z-ai/glm-4.5","z-ai/glm-4.5","Z.ai: GLM 4.5","Z.ai","GLM 4.5","1753471347","GLM-4.5 is our latest flagship foundation model; purpose-built for agent-based applications. It leverages a Mixture-of-Experts (MoE) architecture and supports a context length of up to 128k tokens. GLM-4.5 delivers significantly...","131072","text","text","Other","","0.0000006","0.0000022","","","","","0.00000011","","131072","98304","","include_reasoning|max_tokens|reasoning|response_format|temperature|tool_choice|tools|top_k|top_p","{""temperature"":0.75;""top_p"":null;""frequency_penalty"":null}","2026-12-31","2024-12-31","{""details"":""/api/v1/models/z-ai/glm-4.5/endpoints""}","null","null","zai-org/GLM-4.5","models/3d:elo=1248,wr=59.7,rank=31|models/codecategories:elo=1214,wr=54.4,rank=48|models/dataviz:elo=1204,wr=53.3,rank=48|models/gamedev:elo=1211,wr=54.4,rank=42|models/svg:elo=1154,wr=50.8,rank=43|models/uicomponent:elo=1198,wr=55.1,rank=50|models/website:elo=1212,wr=53.8,rank=49"
"z-ai/glm-4.5-air","z-ai/glm-4.5-air","Z.ai: GLM 4.5 Air","Z.ai","GLM 4.5 Air","1753471258","GLM-4.5-Air is the lightweight variant of our latest flagship model family; also purpose-built for agent-centric applications. Like GLM-4.5; it adopts the Mixture-of-Experts (MoE) architecture but with a more compact parameter...","131072","text","text","Other","","0.00000013","0.00000085","","","","","0.000000025","","131072","98304","","frequency_penalty|include_reasoning|max_tokens|presence_penalty|reasoning|repetition_penalty|seed|stop|temperature|tool_choice|tools|top_k|top_p","{""temperature"":0.75;""top_p"":null;""frequency_penalty"":null}","","2024-12-31","{""details"":""/api/v1/models/z-ai/glm-4.5-air/endpoints""}","null","null","zai-org/GLM-4.5-Air","models/3d:elo=1200,wr=54.1,rank=45|models/codecategories:elo=1187,wr=51.5,rank=59|models/dataviz:elo=1236,wr=59.4,rank=34|models/gamedev:elo=1160,wr=48.4,rank=62|models/svg:elo=1129,wr=50.8,rank=49|models/uicomponent:elo=1178,wr=54.6,rank=55|models/website:elo=1189,wr=51.3,rank=58"
