id,canonical_slug,name,developer,model,created,description,context_length,architecture_input_modalities,architecture_output_modalities,architecture_tokenizer,architecture_instruct_type,pricing_prompt,pricing_completion,pricing_request,pricing_image,pricing_web_search,pricing_internal_reasoning,pricing_input_cache_read,pricing_input_cache_write,top_provider_context_length,top_provider_max_completion_tokens,top_provider_is_moderated,supported_parameters,default_parameters,expiration_date,knowledge_cutoff,links,per_request_limits,supported_voices,hugging_face_id,benchmarks_design_arena
"z-ai/glm-4.7","z-ai/glm-4.7-20251222","Z.ai: GLM 4.7","Z.ai","GLM 4.7","1766378014","GLM-4.7 is Z.ai’s latest flagship model; featuring upgrades in two key areas: enhanced programming capabilities and more stable multi-step reasoning/execution. It demonstrates significant improvements in executing complex agent tasks while...","202752","text","text","Other","","0.0000004","0.00000175","","","","","0.00000008","","202752","131072","","frequency_penalty|include_reasoning|logit_bias|logprobs|max_tokens|min_p|presence_penalty|reasoning|repetition_penalty|response_format|seed|stop|structured_outputs|temperature|tool_choice|tools|top_k|top_logprobs|top_p","{""temperature"":1;""top_p"":0.95;""frequency_penalty"":null}","","","{""details"":""/api/v1/models/z-ai/glm-4.7-20251222/endpoints""}","null","null","zai-org/GLM-4.7","agents/androidnative:elo=1125,wr=56,rank=18|agents/fullstack:elo=1115,wr=44.9,rank=20|agents/godotgamedev:elo=1131,wr=39.1,rank=18|agents/mobileapps:elo=1185,wr=49.9,rank=16|models/3d:elo=1269,wr=54.3,rank=25|models/asciiart:elo=1213,wr=48.3,rank=18|models/codecategories:elo=1266,wr=54.9,rank=28|models/dataviz:elo=1238,wr=51.2,rank=33|models/gamedev:elo=1254,wr=55.1,rank=31|models/svg:elo=1200,wr=54.3,rank=31|models/uicomponent:elo=1251,wr=51,rank=31|models/website:elo=1268,wr=55.4,rank=26"
"google/gemini-3-flash-preview","google/gemini-3-flash-preview-20251217","Google: Gemini 3 Flash Preview","Google","Gemini 3 Flash Preview","1765987078","Gemini 3 Flash Preview is a high speed; high value thinking model designed for agentic workflows; multi turn chat; and coding assistance. It delivers near Pro level reasoning and tool...","1048576","text|image|file|audio|video","text","Gemini","","0.0000005","0.000003","","0.0000005","0.014","0.000003","0.00000005","0.00000008333333333333334","1048576","65535","","include_reasoning|max_tokens|reasoning|response_format|seed|stop|structured_outputs|temperature|tool_choice|tools|top_p","{""temperature"":null;""top_p"":null;""top_k"":null;""frequency_penalty"":null;""presence_penalty"":null;""repetition_penalty"":null}","","","{""details"":""/api/v1/models/google/gemini-3-flash-preview-20251217/endpoints""}","null","null","","agents/agenticslides:elo=1073,wr=39.3,rank=9|agents/agenticslides(python-pptx):elo=1075,wr=39.3,rank=9|agents/androidnative:elo=1060,wr=48,rank=24|agents/fullstack:elo=1128,wr=47.1,rank=17|agents/godotgamedev:elo=1218,wr=52.3,rank=8|agents/mobileapps:elo=1183,wr=49.8,rank=17|agents/webapps:elo=1187,wr=49.5,rank=17|models/3d:elo=1262,wr=62.7,rank=30|models/codecategories:elo=1239,wr=57.6,rank=34|models/gamedev:elo=1232,wr=58.3,rank=39|models/website:elo=1239,wr=57,rank=34"
"black-forest-labs/flux.2-max","black-forest-labs/flux.2-max","Black Forest Labs: FLUX.2 Max","BlackForestLabs","FLUX.2 Max","1765857570","FLUX.2 [max] is the new top-tier image model from Black Forest Labs; pushing image quality; prompt understanding; and editing consistency to the highest level yet. Pricing is as follows; [per...","46864","text|image","image","Other","","0","0","","","","","","","46864","","","seed","{""temperature"":null;""top_p"":null;""frequency_penalty"":null}","","","{""details"":""/api/v1/models/black-forest-labs/flux.2-max/endpoints""}","null","null","",""
"nvidia/nemotron-3-nano-30b-a3b:free","nvidia/nemotron-3-nano-30b-a3b","NVIDIA: Nemotron 3 Nano 30B A3B (free)","NVIDIA","Nemotron 3 Nano 30B A3B (free)","1765731275","NVIDIA Nemotron 3 Nano 30B A3B is a small language MoE model with highest compute efficiency and accuracy for developers to build specialized agentic AI systems. The model is fully...","256000","text","text","Other","","0","0","","","","","","","256000","","","include_reasoning|max_tokens|reasoning|seed|temperature|tool_choice|tools|top_p","{""temperature"":null;""top_p"":null;""frequency_penalty"":null}","","","{""details"":""/api/v1/models/nvidia/nemotron-3-nano-30b-a3b/endpoints""}","null","null","nvidia/NVIDIA-Nemotron-3-Nano-30B-A3B-BF16",""
"nvidia/nemotron-3-nano-30b-a3b","nvidia/nemotron-3-nano-30b-a3b","NVIDIA: Nemotron 3 Nano 30B A3B","NVIDIA","Nemotron 3 Nano 30B A3B","1765731275","NVIDIA Nemotron 3 Nano 30B A3B is a small language MoE model with highest compute efficiency and accuracy for developers to build specialized agentic AI systems. The model is fully...","262144","text","text","Other","","0.00000005","0.0000002","","","","","","","262144","228000","","frequency_penalty|include_reasoning|logit_bias|logprobs|max_tokens|min_p|presence_penalty|reasoning|repetition_penalty|response_format|seed|stop|structured_outputs|temperature|tool_choice|tools|top_k|top_logprobs|top_p","{""temperature"":null;""top_p"":null;""frequency_penalty"":null}","","","{""details"":""/api/v1/models/nvidia/nemotron-3-nano-30b-a3b/endpoints""}","null","null","nvidia/NVIDIA-Nemotron-3-Nano-30B-A3B-BF16",""
"openai/gpt-5.2-chat","openai/gpt-5.2-chat-20251211","OpenAI: GPT-5.2 Chat","OpenAI","GPT-5.2 Chat","1765389783","GPT-5.2 Chat (AKA Instant) is the fast; lightweight member of the 5.2 family; optimized for low-latency chat while retaining strong general intelligence. It uses adaptive reasoning to selectively “think” on...","128000","file|image|text","text","GPT","","0.00000175","0.000014","","","0.01","","0.000000175","","128000","16384","true","max_completion_tokens|max_tokens|response_format|seed|structured_outputs|tool_choice|tools","{""temperature"":null;""top_p"":null;""frequency_penalty"":null}","2026-08-10","","{""details"":""/api/v1/models/openai/gpt-5.2-chat-20251211/endpoints""}","null","null","",""
"openai/gpt-5.2-pro","openai/gpt-5.2-pro-20251211","OpenAI: GPT-5.2 Pro","OpenAI","GPT-5.2 Pro","1765389780","GPT-5.2 Pro is OpenAI’s most advanced model; offering major improvements in agentic coding and long context performance over GPT-5 Pro. It is optimized for complex tasks that require step-by-step reasoning;...","400000","image|text|file","text","GPT","","0.000021","0.000168","","","0.01","","","","400000","128000","true","include_reasoning|max_tokens|reasoning|response_format|seed|structured_outputs|tool_choice|tools","{""temperature"":null;""top_p"":null;""frequency_penalty"":null}","","","{""details"":""/api/v1/models/openai/gpt-5.2-pro-20251211/endpoints""}","null","null","",""
"openai/gpt-5.2","openai/gpt-5.2-20251211","OpenAI: GPT-5.2","OpenAI","GPT-5.2","1765389775","GPT-5.2 is the latest frontier-grade model in the GPT-5 series; offering stronger agentic and long context perfomance compared to GPT-5.1. It uses adaptive reasoning to allocate computation dynamically; responding quickly...","400000","file|image|text","text","GPT","","0.00000175","0.000014","","","0.01","","0.000000175","","400000","128000","true","include_reasoning|max_completion_tokens|max_tokens|reasoning|response_format|seed|structured_outputs|tool_choice|tools","{""temperature"":null;""top_p"":null;""top_k"":null;""frequency_penalty"":null;""presence_penalty"":null;""repetition_penalty"":null}","","","{""details"":""/api/v1/models/openai/gpt-5.2-20251211/endpoints""}","null","null","","models/website:elo=1237,wr=54.5,rank=35|agents/androidnative:elo=1071,wr=49.2,rank=23|agents/fullstack:elo=1108,wr=44,rank=21|agents/godotgamedev:elo=1182,wr=48.1,rank=13|agents/mobileapps:elo=1169,wr=47.4,rank=23|agents/webapps:elo=1158,wr=45.7,rank=19|models/3d:elo=1157,wr=41.8,rank=61|models/codecategories:elo=1219,wr=50,rank=43|models/dataviz:elo=1245,wr=56.1,rank=32|models/gamedev:elo=1260,wr=56,rank=30|models/uicomponent:elo=1243,wr=51.7,rank=33|models/asciiart:elo=1199,wr=50.7,rank=22|models/svg:elo=1197,wr=53.8,rank=33"
"mistralai/devstral-2512","mistralai/devstral-2512","Mistral: Devstral 2 2512","Mistral","Devstral 2 2512","1765285419","Devstral 2 is a state-of-the-art open-source model by Mistral AI specializing in agentic coding. It is a 123B-parameter dense transformer model supporting a 256K context window. Devstral 2 supports exploring...","262144","text|file","text","Mistral","","0.0000004","0.000002","","","","","0.00000004","","262144","","","frequency_penalty|max_tokens|presence_penalty|response_format|seed|stop|structured_outputs|temperature|tool_choice|tools|top_p","{""temperature"":0.3;""top_p"":null;""frequency_penalty"":null}","","","{""details"":""/api/v1/models/mistralai/devstral-2512/endpoints""}","null","null","mistralai/Devstral-2-123B-Instruct-2512",""
"relace/relace-search","relace/relace-search-20251208","Relace: Relace Search","Relace","Relace Search","1765213560","The relace-search model uses 4-12 `view_file` and `grep` tools in parallel to explore a codebase and return relevant files to the user request. In contrast to RAG; relace-search performs agentic...","256000","text","text","Other","","0.000001","0.000003","","","","","","","256000","128000","","max_tokens|response_format|seed|stop|temperature|tool_choice|tools|top_p","{""temperature"":null;""top_p"":null;""frequency_penalty"":null}","","","{""details"":""/api/v1/models/relace/relace-search-20251208/endpoints""}","null","null","",""
"z-ai/glm-4.6v","z-ai/glm-4.6-20251208","Z.ai: GLM 4.6V","Z.ai","GLM 4.6V","1765207462","GLM-4.6V is a large multimodal model designed for high-fidelity visual understanding and long-context reasoning across images; documents; and mixed media. It supports up to 128K tokens; processes complex page layouts...","131072","image|text|video","text","Other","","0.0000003","0.0000009","","","","","0.000000055","","131072","32768","","frequency_penalty|include_reasoning|max_tokens|presence_penalty|reasoning|repetition_penalty|response_format|seed|stop|temperature|tool_choice|tools|top_k|top_p","{""temperature"":0.8;""top_p"":0.6;""frequency_penalty"":null}","","","{""details"":""/api/v1/models/z-ai/glm-4.6-20251208/endpoints""}","null","null","zai-org/GLM-4.6V",""
"openrouter/bodybuilder","openrouter/bodybuilder","Body Builder (beta)","BodyBuilder(beta)","","1764903653","Transform your natural language requests into structured OpenRouter API request objects. Describe what you want to accomplish with AI models; and Body Builder will construct the appropriate API calls. Example:...","128000","text","text","Router","","-1","-1","","","","","","","","","","","{""temperature"":null;""top_p"":null;""frequency_penalty"":null}","","","{""details"":""/api/v1/models/openrouter/bodybuilder/endpoints""}","null","null","",""
"openai/gpt-5.1-codex-max","openai/gpt-5.1-codex-max-20251204","OpenAI: GPT-5.1-Codex-Max","OpenAI","GPT-5.1-Codex-Max","1764878934","GPT-5.1-Codex-Max is OpenAI’s latest agentic coding model; designed for long-running; high-context software development tasks. It is based on an updated version of the 5.1 reasoning stack and trained on agentic...","400000","text|image","text","GPT","","0.00000125","0.00001","","","0.01","","0.000000125","","400000","128000","true","include_reasoning|max_completion_tokens|max_tokens|reasoning|response_format|seed|structured_outputs|tool_choice|tools","{""temperature"":null;""top_p"":null;""top_k"":null;""frequency_penalty"":null;""presence_penalty"":null;""repetition_penalty"":null}","","","{""details"":""/api/v1/models/openai/gpt-5.1-codex-max-20251204/endpoints""}","null","null","",""
"amazon/nova-2-lite-v1","amazon/nova-2-lite-v1","Amazon: Nova 2 Lite","Amazon","Nova 2 Lite","1764696672","Nova 2 Lite is a fast; cost-effective reasoning model for everyday workloads that can process text; images; and videos to generate text. Nova 2 Lite demonstrates standout capabilities in processing...","1000000","text|image|video|file","text","Nova","","0.0000003","0.0000025","","","","","","","1000000","65535","true","include_reasoning|max_tokens|reasoning|stop|temperature|tool_choice|tools|top_k|top_p","{""temperature"":null;""top_p"":null;""frequency_penalty"":null}","","","{""details"":""/api/v1/models/amazon/nova-2-lite-v1/endpoints""}","null","null","",""
"mistralai/ministral-14b-2512","mistralai/ministral-14b-2512","Mistral: Ministral 3 14B 2512","Mistral","Ministral 3 14B 2512","1764681735","The largest model in the Ministral 3 family; Ministral 3 14B offers frontier capabilities and performance comparable to its larger Mistral Small 3.2 24B counterpart. A powerful and efficient language...","262144","text|image","text","Mistral","","0.0000002","0.0000002","","","","","0.00000002","","262144","","","frequency_penalty|logprobs|max_tokens|presence_penalty|repetition_penalty|response_format|seed|stop|structured_outputs|temperature|tool_choice|tools|top_logprobs|top_p","{""temperature"":0.3;""top_p"":null;""frequency_penalty"":null}","","","{""details"":""/api/v1/models/mistralai/ministral-14b-2512/endpoints""}","null","null","mistralai/Ministral-3-14B-Instruct-2512","models/3d:elo=1068,wr=39.6,rank=82|models/codecategories:elo=1114,wr=44,rank=79|models/gamedev:elo=1104,wr=43.6,rank=78|models/website:elo=1124,wr=44.8,rank=80"
"mistralai/ministral-8b-2512","mistralai/ministral-8b-2512","Mistral: Ministral 3 8B 2512","Mistral","Ministral 3 8B 2512","1764681654","A balanced model in the Ministral 3 family; Ministral 3 8B is a powerful; efficient tiny language model with vision capabilities.","262144","text|image","text","Mistral","","0.00000015","0.00000015","","","","","0.000000015","","262144","","","frequency_penalty|logprobs|max_tokens|presence_penalty|repetition_penalty|response_format|seed|stop|structured_outputs|temperature|tool_choice|tools|top_logprobs|top_p","{""temperature"":0.3;""top_p"":null;""frequency_penalty"":null}","","","{""details"":""/api/v1/models/mistralai/ministral-8b-2512/endpoints""}","null","null","mistralai/Ministral-3-8B-Instruct-2512","models/3d:elo=1109,wr=46.2,rank=76|models/codecategories:elo=1102,wr=42.9,rank=81|models/gamedev:elo=1056,wr=38.7,rank=86|models/website:elo=1108,wr=42.9,rank=82"
"mistralai/ministral-3b-2512","mistralai/ministral-3b-2512","Mistral: Ministral 3 3B 2512","Mistral","Ministral 3 3B 2512","1764681560","The smallest model in the Ministral 3 family; Ministral 3 3B is a powerful; efficient tiny language model with vision capabilities.","131072","text|image","text","Mistral","","0.0000001","0.0000001","","","","","0.00000001","","131072","","","frequency_penalty|logprobs|max_tokens|presence_penalty|repetition_penalty|response_format|seed|stop|structured_outputs|temperature|tool_choice|tools|top_logprobs|top_p","{""temperature"":0.3;""top_p"":null;""frequency_penalty"":null}","","","{""details"":""/api/v1/models/mistralai/ministral-3b-2512/endpoints""}","null","null","mistralai/Ministral-3-3B-Instruct-2512","models/3d:elo=1040,wr=35.9,rank=88|models/codecategories:elo=1059,wr=37.3,rank=89|models/gamedev:elo=1014,wr=33,rank=97|models/website:elo=1070,wr=38.2,rank=90"
"mistralai/mistral-large-2512","mistralai/mistral-large-2512","Mistral: Mistral Large 3 2512","Mistral","Mistral Large 3 2512","1764624472","Mistral Large 3 2512 is Mistral’s most capable model to date; featuring a sparse mixture-of-experts architecture with 41B active parameters (675B total); and released under the Apache 2.0 license.","262144","text|image|file","text","Mistral","","0.0000005","0.0000015","","","","","0.00000005","","262144","","","frequency_penalty|max_tokens|presence_penalty|response_format|seed|stop|structured_outputs|temperature|tool_choice|tools|top_p","{""temperature"":0.0645;""top_p"":null;""frequency_penalty"":null}","","","{""details"":""/api/v1/models/mistralai/mistral-large-2512/endpoints""}","null","null","","models/3d:elo=1177,wr=46.9,rank=52|models/asciiart:elo=1115,wr=40.3,rank=44|models/codecategories:elo=1191,wr=47.6,rank=57|models/dataviz:elo=1180,wr=45.8,rank=56|models/gamedev:elo=1146,wr=41.5,rank=66|models/svg:elo=1049,wr=38,rank=65|models/uicomponent:elo=1155,wr=43.1,rank=60|models/website:elo=1205,wr=49.4,rank=54"
"arcee-ai/trinity-mini","arcee-ai/trinity-mini-20251201","Arcee AI: Trinity Mini","ArceeAI","Trinity Mini","1764601720","Trinity Mini is a 26B-parameter (3B active) sparse mixture-of-experts language model featuring 128 experts with 8 active per token. Engineered for efficient reasoning over long contexts (131k) with robust function...","131072","text","text","Other","","0.000000045","0.00000015","","","","","","","131072","131072","","include_reasoning|logprobs|max_completion_tokens|max_tokens|reasoning|response_format|stop|structured_outputs|temperature|tool_choice|tools|top_k|top_logprobs|top_p","{""temperature"":0.15;""top_p"":0.75;""frequency_penalty"":null}","2026-07-10","","{""details"":""/api/v1/models/arcee-ai/trinity-mini-20251201/endpoints""}","null","null","arcee-ai/Trinity-Mini",""
"deepseek/deepseek-v3.2","deepseek/deepseek-v3.2-20251201","DeepSeek: DeepSeek V3.2","DeepSeek","DeepSeek V3.2","1764594642","DeepSeek-V3.2 is a large language model designed to harmonize high computational efficiency with strong reasoning and agentic tool-use performance. It introduces DeepSeek Sparse Attention (DSA); a fine-grained sparse attention mechanism...","131072","text","text","DeepSeek","","0.0000002288","0.0000003432","","","","","0.00000002288","","128000","64000","","frequency_penalty|include_reasoning|logit_bias|logprobs|max_tokens|min_p|presence_penalty|reasoning|repetition_penalty|response_format|seed|stop|structured_outputs|temperature|tool_choice|tools|top_k|top_logprobs|top_p","{""temperature"":1;""top_p"":0.95;""top_k"":null;""frequency_penalty"":null;""presence_penalty"":null;""repetition_penalty"":null}","","","{""details"":""/api/v1/models/deepseek/deepseek-v3.2-20251201/endpoints""}","null","null","deepseek-ai/DeepSeek-V3.2","models/3d:elo=1212,wr=49.8,rank=42|models/asciiart:elo=1129,wr=40.5,rank=43|models/codecategories:elo=1213,wr=49.5,rank=49|models/dataviz:elo=1201,wr=48.5,rank=49|models/gamedev:elo=1198,wr=46.7,rank=51|models/svg:elo=1090,wr=40.9,rank=55|models/uicomponent:elo=1202,wr=46.9,rank=48|models/website:elo=1217,wr=50.4,rank=47"
"black-forest-labs/flux.2-flex","black-forest-labs/flux.2-flex","Black Forest Labs: FLUX.2 Flex","BlackForestLabs","FLUX.2 Flex","1764045987","FLUX.2 [flex] excels at rendering complex text; typography; and fine details; and supports multi-reference editing in the same unified architecture. Pricing is as follows; [per the docs](https://bfl.ai/pricing?category=flux.2): We charge $0.06...","67344","text|image","image","Other","","0","0","","","","","","","67344","","","seed","{""temperature"":null;""top_p"":null;""frequency_penalty"":null}","","","{""details"":""/api/v1/models/black-forest-labs/flux.2-flex/endpoints""}","null","null","","models/graphicdesign:elo=1224,wr=55.1,rank=5|models/image:elo=1230,wr=56.3,rank=5|models/logo:elo=1232,wr=56,rank=4"
"black-forest-labs/flux.2-pro","black-forest-labs/flux.2-pro","Black Forest Labs: FLUX.2 Pro","BlackForestLabs","FLUX.2 Pro","1764030274","A high-end image generation and editing model focused on frontier-level visual quality and reliability. It delivers strong prompt adherence; stable lighting; sharp textures; and consistent character/style reproduction across multi-reference inputs....","46864","text|image","image","Other","","0","0","","","","","","","46864","","","seed","{""temperature"":null;""top_p"":null;""frequency_penalty"":null}","","","{""details"":""/api/v1/models/black-forest-labs/flux.2-pro/endpoints""}","null","null","","models/graphicdesign:elo=1208,wr=49,rank=7|models/image:elo=1225,wr=50.8,rank=6|models/logo:elo=1215,wr=49.5,rank=7|models/imageediting:elo=1158,wr=49.8,rank=4"
"anthropic/claude-opus-4.5","anthropic/claude-4.5-opus-20251124","Anthropic: Claude Opus 4.5","Anthropic","Claude Opus 4.5","1764010580","Claude Opus 4.5 is Anthropic’s frontier reasoning model optimized for complex software engineering; agentic workflows; and long-horizon computer use. It offers strong multimodal capabilities; competitive performance across real-world coding and...","200000","file|image|text","text","Claude","","0.000005","0.000025","","","0.01","","0.0000005","0.00000625","200000","64000","true","include_reasoning|max_tokens|reasoning|response_format|stop|structured_outputs|temperature|tool_choice|tools|top_k|verbosity","{""temperature"":null;""top_p"":null;""top_k"":null;""frequency_penalty"":null;""presence_penalty"":null;""repetition_penalty"":null}","","","{""details"":""/api/v1/models/anthropic/claude-4.5-opus-20251124/endpoints""}","null","null","","models/3d:elo=1291,wr=59.7,rank=20|models/asciiart:elo=1234,wr=54.8,rank=12|models/codecategories:elo=1292,wr=59.9,rank=18|models/dataviz:elo=1286,wr=58.8,rank=14|models/gamedev:elo=1295,wr=59.5,rank=19|models/svg:elo=1238,wr=58.7,rank=18|models/uicomponent:elo=1292,wr=58.6,rank=19|models/website:elo=1290,wr=59.9,rank=19|agents/androidnative:elo=1188,wr=65.5,rank=13|agents/fullstack:elo=1222,wr=59.9,rank=9|agents/mobileapps:elo=1236,wr=57.5,rank=6|agents/webapps:elo=1222,wr=54.2,rank=11"
"allenai/olmo-3-32b-think","allenai/olmo-3-32b-think-20251121","AllenAI: Olmo 3 32B Think","AllenAI","Olmo 3 32B Think","1763758276","Olmo 3 32B Think is a large-scale; 32-billion-parameter model purpose-built for deep reasoning; complex logic chains and advanced instruction-following scenarios. Its capacity enables strong performance on demanding evaluation tasks and...","65536","text","text","Other","","0.00000015","0.0000005","","","","","","","65536","65536","","frequency_penalty|include_reasoning|logit_bias|max_tokens|presence_penalty|reasoning|repetition_penalty|response_format|seed|stop|structured_outputs|temperature|top_k|top_p","{""temperature"":0.6;""top_p"":0.95;""frequency_penalty"":null}","","","{""details"":""/api/v1/models/allenai/olmo-3-32b-think-20251121/endpoints""}","null","null","allenai/Olmo-3-32B-Think",""
"google/gemini-3-pro-image-preview","google/gemini-3-pro-image-preview-20251120","Google: Nano Banana Pro (Gemini 3 Pro Image Preview)","Google","Nano Banana Pro (Gemini 3 Pro Image Preview)","1763653797","Nano Banana Pro is Google’s most advanced image-generation and editing model; built on Gemini 3 Pro. It extends the original Nano Banana with significantly improved multimodal reasoning; real-world grounding; and...","65536","image|text","image|text","Gemini","","0.000002","0.000012","","0.000002","0.014","0.000012","0.0000002","0.000000375","65536","32768","","include_reasoning|max_tokens|reasoning|response_format|seed|stop|structured_outputs|temperature|top_p","{""temperature"":null;""top_p"":null;""frequency_penalty"":null}","","","{""details"":""/api/v1/models/google/gemini-3-pro-image-preview-20251120/endpoints""}","null","null","","models/graphicdesign:elo=1286,wr=66,rank=3|models/image:elo=1272,wr=62.2,rank=3|models/logo:elo=1260,wr=61,rank=3|models/imageediting:elo=1273,wr=66.1,rank=2"
"thenlper/gte-base","thenlper/gte-base-20251117","Thenlper: GTE-Base","Thenlper","GTE-Base","1763433820","The gte-base embedding model encodes English sentences and paragraphs into a 768-dimensional dense vector space; delivering efficient and effective semantic embeddings optimized for textual similarity; semantic search; and clustering applications.","8192","text","embeddings","Other","","0.000000005","0","","","","","","","512","","","frequency_penalty|max_tokens|min_p|presence_penalty|repetition_penalty|response_format|seed|stop|temperature|top_k|top_p","{""temperature"":null;""top_p"":null;""frequency_penalty"":null}","","","{""details"":""/api/v1/models/thenlper/gte-base-20251117/endpoints""}","null","null","thenlper/gte-base",""
"thenlper/gte-large","thenlper/gte-large-20251117","Thenlper: GTE-Large","Thenlper","GTE-Large","1763433655","The gte-large embedding model converts English sentences; paragraphs and moderate-length documents into a 1024-dimensional dense vector space; delivering high-quality semantic embeddings optimized for information retrieval; semantic textual similarity; reranking and...","8192","text","embeddings","Other","","0.00000001","0","","","","","","","512","","","frequency_penalty|max_tokens|min_p|presence_penalty|repetition_penalty|response_format|seed|stop|temperature|top_k|top_p","{""temperature"":null;""top_p"":null;""frequency_penalty"":null}","","","{""details"":""/api/v1/models/thenlper/gte-large-20251117/endpoints""}","null","null","thenlper/gte-large",""
"intfloat/e5-large-v2","intfloat/e5-large-v2-20251117","Intfloat: E5-Large-v2","Intfloat","E5-Large-v2","1763433432","The e5-large-v2 embedding model maps English sentences; paragraphs; and documents into a 1024-dimensional dense vector space; delivering high-accuracy semantic embeddings optimized for retrieval; semantic search; reranking; and similarity-scoring tasks.","8192","text","embeddings","Other","","0.00000001","0","","","","","","","512","","","frequency_penalty|max_tokens|min_p|presence_penalty|repetition_penalty|response_format|seed|stop|temperature|top_k|top_p","{""temperature"":null;""top_p"":null;""frequency_penalty"":null}","","","{""details"":""/api/v1/models/intfloat/e5-large-v2-20251117/endpoints""}","null","null","intfloat/e5-large-v2",""
